202,5913180144,what does the man in blue socks do after he was put down by the man in grey suit?,"['arm wrestle', 'play with sand', 'walk along the lighted up wall', 'take a step away', 'bite him']",2,3
203,2834146886,how many dogs are there?,"['four', 'one', 'two', 'six', 'three']",1,2
204,2454242177,which direction did the baby push the blue toy after the start?,"['backward', 'let go of one hand and turn', 'pick them up from yellow part', 'forward', 'hit his legs']",3,0
205,2604394962,why did the man put the toy on the ledge of the wall?,"['stay balance to go up', 'to attract the boy', 'play with it', 'stabilise', 'for cat to play']",4,2
206,5205081904,why does the child turn around near the end of the video?,"['reaching for bottle', 'talking', 'he got the pacifier', 'to climb down the stairs', 'picks up the grey jacket']",1,4
208,4967810888,why does the woman in white bend down while walking in near the end?,"['ensure she do nt fall', 'pick up a bag', 'pose', 'touch lady in blue', 'stay clear of the plant']",0,4
210,4765564263,how did the boy in black pants moved from place to place?,"['walk', 'jump', 'cycling', 'on scooter', 'swimming']",1,0
212,2584172238,why did the woman place her hand at the boy s hip in the middle of the video?,"['take balloon away from baby', 'support boy', 'get closer to the bell', 'clean the hip', 'check whether baby peed']",2,1
213,4882821564,how did the boy react when he entered the room at the start?,"['dance', 'run', 'stretch his hand out', 'smile', 'walk close to it and look']",4,3
214,3192668394,why did the man in black sweater hold up a cup of water while talking to friends?,"['take a picture', 'hand the drink to someone', 'tell the lady something', 'wants to try pouring the water', 'drink']",4,4
215,14012319794,why did the girl pull the tent down towards her in the middle of the video?,"['take the book', 'try to take flag on top', 'carry the baby', 'pick up something on the floor', 'talking about it']",2,1
216,4273039295,how is the boy moving around?,"['hiking', 'walking', 'adult carry him', 'flying fox', 'skiing']",1,1
218,4626535366,why does the kid stands near the poster?,"['drawing on the poster', 'posing for a picture', 'adjusting height of the poster', 'talking about cleanliness to audience', 'scared the psoter will fall']",3,3
219,3345608051,where are the dogs fighting?,"['barren land', 'snow wild', 'living room', 'garden', 'grass patch']",0,0
220,6024684644,why did the man bend so low?,"['stabilise himself', 'adjust shoes', 'hiding from the dog', 'avoiding the sun', 'the hole is very deep']",2,4
221,3078294001,why does the man in white move away from the man in black in the middle?,"['take his shoes', 'starts walking while talking', 'get a drink', 'answer phone call', 'help the chef']",2,1
222,4762946272,what did the boy do after the woman poured the flour into the spoon?,"['take out candle', 'nodding and smiling', 'happy', 'pour flour', 'looking at her']",1,3
223,4087013668,where is this video taken?,"['bedroom', 'speech event', 'mountain', 'kitchen', 'playground']",0,3
224,11584566583,how did the woman in green adjusts her glasses at the middle?,"['push up using finger', 'take off and put on', 'held on to sides of ladder', 'nods her head', 'point her boards to make triangle']",0,0
225,4010069381,why does the man in brown look towards his back?,"['wait for the girl', 'check the screen', 'playing guitar', 'dancing together', 'talk to lady']",2,4
226,2573424030,why did the dog stand on 2 legs after seeing the man give a treat to the baby?,"['wanted food', 'wants to get pet', 'smile at camera', 'bigger dog didnt want it', 'man touches it']",2,0
227,8513603944,what does the child in blue helmet do after turning around?,"['the girls riding', 'continue walking', 'moves the object', 'reading something', 'eat it']",0,1
402,8225502382,how many times does the man in dark green attempt to go up the slope?,"['one', 'eight', 'five', 'three', 'twelve']",1,2
403,8224504302,how do the men speak into the microphone on stage?,"['show slides', 'hold microphone in hands', 'microphones on collar', 'take turns', 'sway his body']",2,3
404,4132599924,why did the eyes of the man hardly leaving the computer and the panel?,"['focus on adjusting the music', 'looking at script', 'dancing with her', 'shooting show', 'recording the people performing']",0,0
406,2552130183,what does the baby do after the lady lays it down on the ground near the end?,"['throws the pink toy', 'crawls', 'plays with the baby', 'roll onto her stomach', 'approach baby']",1,1
407,2679328607,why does the man in red place the children on his lap?,"['playing with them', 'colour with them', 'read them books', 'listening music together', 'pat them to sleep']",3,2
408,5056964274,why did the boy move hands closer to mouth?,"['to wipe his mouth', 'suck his thumb', 'spit out food', 'cover his mouth', 'to eat']",1,4
409,5116088152,why did the baby let go of the banana at the end?,"['to give the kids', 'feed monkey', 'does not hold well', 'girl snatch it away', 'someone asked him to do']",2,2
410,7088595057,what happened to the black sheep after it tried to get up from the floor?,"['sniff slippers', 'fell back', 'get up slightly', 'look at dog', 'plays with the brown dog']",1,1
411,7728559968,why do the kittens attempt to bite each other?,"['change playing position', 'ticklish', 'to win the other cat', 'play fighting', 'fight with dog']",3,2
412,5173770364,what does the adult do as the baby plays with the adult s leg?,"['comfortable', 'walk behind', 'playing toys', 'sitting', 'lie down']",3,4
413,3345608051,why is there a man walking near the fighting field in the middle of the video?,"['wants to join in the fight', 'want to jump into the pool', 'pushed by sumo wrestlers', 'chased by some dogs', 'capturing the moment']",3,4
414,3429509208,how did the boy move himself nearer to the camera?,"['crawl on floor', 'with baby walker', 'push the vacuum cleaner', 'legs', 'talk and touch']",1,2
416,5902452647,what does the girl do after the boy walks a few steps towards her in the middle?,"['put envelop on table', 'pass boy kite handle', 'walks backwards', 'walk to the sofa', 'kiss girl']",2,2
417,4603484665,how did the brown dog react after being ignored by the pair of dogs playing?,"['dig snow', 'jumps down', 'walk away', 'smile and wants to pet it', 'played along with him']",2,2
418,5658916668,how many people were filmed sliding down?,"['four', 'one', 'seven', 'two', 'six']",5,1
419,3477387686,how did the girl show affection to the dog at the end of the video?,"['make a sad face', 'kiss dog', 'caress its neck', 'turns it round and round', 'rubs the dog']",2,1
420,11244289523,what is the occasion in the video?,"['wedding', 'cosplay', 'birthday', 'colleagues', 'computer screen']",2,2
422,10042935613,why does the shirtless man walk in near the middle of the video?,"['to bring the food', 'explain something', 'gesturing', 'ice cream dropped on himself', 'to eat the food']",3,4
423,4024008346,how did the person react after the child pushes the blue ballon away at the beginning?,"['chase the girl', 'continue playing with toy', 'kick the blue balloon towards the child', 'put it in cylinder', 'change hands to hold']",1,2
424,3452354871,why did the man lift up his sole after the bird gotten off his foot?,"['to swing the baby high', 'see what is underneath', 'cleaning itself', 'caressing for dog', 'push baby faster']",3,1
426,8208035645,what happened to the boy when he cycled upslope at the end?,"['man stopped his bicycle', 'comes down', 'fall off the bicycle', 'continue playing with the rod', 'sitting still']",2,1
427,2973331780,what is the possible relationship between the lady in black and the lady with blonde hair?,"['train trainee', 'friends', 'teacher student', 'mother and daughter', 'colleagues']",1,1
428,2679328607,why does the man in red hold a book in his hand?,"['wanted to do colouring with the kids', 'read his lines', 'show the children a picture of a dog', 'read the book', 'guide the students']",1,3
429,8177965766,what did the woman do to the microphone after awhile?,"['walk away', 'smiles', 'she talks to the other people', 'switch to the other hand', 'talks']",3,3
602,5349766264,why is the man in chequered shirt waving his hands and moving his shoulders vigorously?,"['focused', 'take the food', 'he is dancing', 'check what been fixed', 'make funny expressions']",2,2
603,2731071928,why is the child hitting the guitar in the middle of the video?,"['look at the man', 'strumming the guitar', 'get into rhythm', 'out of excitement', 'performing']",1,1
604,8428551576,why does the baby disconnect the speaker from the ipod at the start of the video?,"['to see the toy', 'to place ipod on book shelf', 'to turn on the screen', 'to throw ipod away', 'listen directly from ipod']",2,4
606,5433090067,how was the girl positioned at the start of the video?,"['lying in bed', 'standing', 'sit on the toy cart', 'open her arms', 'sit on mat']",1,1
607,8208035645,what does the boy do after going downslope at the start?,"['wave at girl', 'take kite from man', 'stop the bicycle', 'unhappy', 'cycle towards left']",0,4
609,5056964274,what is the baby doing when someone holds a box of drink at the start?,"['grab the drink', 'push away hand', 'insert straw into box', 'lean forward and touch table', 'claps and run closer']",0,2
610,6754608321,what color is the baby s clothes?,"['black and red', 'yellow and red', 'yellow', 'white', 'green']",4,4
612,2973331780,why did the lady in black hold one hands up after singing for a while?,"['dance move', 'hold her arms tight', 'lady in white pulling rope', 'show her phone', 'reading from the paper']",0,0
615,4984331176,why did the man in white and lady in blue hold each others hands?,"['skip together', 'stablisie lady in blue', 'dancing together', 'putting on the ring', 'fighting']",3,0
618,3249402410,how did the lady in black on the right spread the chesse around the pizza?,"['sprinkle', 'use brush', 'use spoon', 'nibble', 'use her mouth']",0,0
619,3427674558,what happened at the back of stage when someone walked past the camera?,"['lights on the stage blink', 'someone sat down', 'playing piano', 'walk back into room', 'take something']",0,1
620,4859057828,why did the lady in yellow stretch her arms out at the start?,"['record for later use', 'hold baby', 'pose for picture', 'want to pet the brown dog', 'snacks to eat']",2,2
621,2957808913,how does the man in black jacket move his legs at the start of the video?,"['bending', 'kick', 'standing', 'swing', 'kiss man']",2,0
622,4179163342,what did the dog do after the girl hugged it in the middle of the video?,"['plays with him', 'run', 'walk off', 'look at the baby', 'observe dog']",2,2
623,2401167740,what does the man do after he finishes talking?,"['use microphone', 'drink the cup', 'talks to the lady', 'turn around', 'raise his hand']",0,1
624,5256928210,what does the man wear on his head?,"['scarf', 'cap', 'turban', 'spectacles', 'scarf']",1,1
625,7508439506,what is the man doing while the boy plays with the baby?,"['put into his mouth', 'football', 'unwrapping a gift', 'smile', 'lying down']",4,4
626,7988210561,how did the baby interact with the toy?,"['swing the toy', 'carry it aorund', 'move it in circle', 'touch toy with her hands', 'kick it']",3,3
628,6097994550,how does the man with spectacles move at the end of the video?,"['walk', 'caress his head', 'count with fingers', 'crawls', 'strolls around']",0,3
802,4276006683,what does the cat do after the person puts his finger into its mouth in the middle?,"['bite it', 'rubs against him', 'bring it down', 'closed it eyes', 'sit up']",4,0
803,6618792571,why did the baby hold on to something as she moves?,"['hold toy doll', 'pass to girl', 'dog leash', 'riding bicycle', 'pushing toy cart']",0,4
805,2584172238,how are the baby in blue and woman in yellow related?,"['mother', 'friends', 'father son', 'parent offspring', 'make the baby calm']",0,3
806,4087654898,why are there so many brown leaves on the ground?,"['after shaved', 'obstacles', 'fallen from trees', 'autumn', 'doors open']",3,2
807,3345608051,why is there a dog lying on ground in the middle?,"['playing with boy', 'feed her puppies', 'sleeping', 'bite and pull the toy', 'pushed down by dog']",3,4
809,8107573462,how did the man make sure that the boy does not get drag on the ground when he fell?,"['checks on him', 'was quiet', 'bib', 'let go of boy s hand', 'wearing helmet']",3,3
810,7961460440,where is this video taken?,"['studio', 'boxing ring', 'park', 'outdoor', 'train']",3,3
811,7453733046,where are the people hanging out?,"['outside house', 'water park', 'at a house', 'bus', 'studio']",2,1
812,3198533789,why is the orange man standing at the side?,"['checking train', 'playing the guitar', 'to catch the ball', 'oversee the process', 'talking to someone']",3,3
815,4765717907,what did the man do after the boy picked up the ball near the middle?,"['look in the direction of ball', 'try to get ball back', 'kick the ball', 'look to the left', 'carries him']",3,4
816,3429509208,why does the baby turns the vacuum cleaner in a particular direction near the end?,"['to push door back', 'he was stuck at the sofa', 'interested in the store', 'clean the corner', 'want to turn back']",4,4
817,2978295992,why did the lady with the pumpkin stretch her hand out over the table at the end?,"['place a piece of pumpkin', 'celebrate birthday', 'wipe her hands', 'get tissues', 'mixing ingredients together in bowl']",1,0
818,5205081904,why does the child constantly look down?,"['sleepy', 'playing with a toy', 'playing game', 'looking at the tablet', 'safety']",3,3
819,6988748711,why did the grey shirt woman stand at the side while watching the red shirt man pull cloth open?,"['wash hairs', 'focus on her', 'listening', 'in case he needs helps', 'read marriage vows']",3,3
820,3261079025,why did one of the man have to hold onto the plane before it took off?,"['support himself', 'strong wind', 'the boy could not control it', 'stabilize it', 'taking off']",4,3
821,7499763064,what does the man do as the lady in blue was waiting behind him?,"['point at his basket', 'walk to bald man', 'runs away', 'sitting', 'try to get higher']",4,4
822,6542914065,where is this happening?,"['garden', 'wooded areas', 'field', 'footpath', 'home']",2,2
823,5854324479,what event is happening?,"['concert', 'speech', 'water skiing', 'boxing game', 'stage']",1,1
826,4372494989,what does the baby do after being picked up?,"['fall down', 'suck thumb', 'clasp his hands together', 'reading book', 'crawling on the ground']",1,2
827,4103088549,why did the man spread his arms out?,"['massage', 'to hug the baby', 'rowing boat', 'to balance on the surfboard', 'skydiving']",3,3
828,3402648543,why does the big dog run behind the house?,"['fethc ball', 'chasing the car', 'playing', 'hide from small dogs', 'guide direction']",2,3
829,4967810888,what did the lady with blonde hair do after she entered the room?,"['stand up', 'leave the room', 'turn back to window', 'run towards the camera', 'sat down']",0,4
830,2435633172,why was the pig sticking its mouth down at the start?,"['getting fur shaved', 'tease the dog', 'eat', 'playing with dog', 'playing with it by biting']",3,2
831,6233408665,what did the girl in green do after the girl in grey put the board near her face?,"['other side of table', 'raised up both hands', 'adjust the girl s clothes', 'push the board away', 'try to pull it open']",4,3
832,4984417707,what was the man in red next to the brown sign board at the end doing while the elephants were playing with the ball?,"['point at the trucks', 'throw away the ball', 'blows thw whistle', 'walk around', 'look at the red car']",1,1
833,2984974097,what does the girl do after she starts paddling?,"['continue cycling', 'said something', 'row using hands', 'floating', 'keep looking down at pedal']",0,4
834,8457210773,how did the brown dog react when playing with the black dog at the start?,"['barked back', 'jump again', 'jumps down', 'bite dog', 'faces brown dog']",0,3
835,2679328607,what does the boy do with the toy after the girl passes it to him?,"['look down', 'kick her legs', 'bite it', 'turn to her', 'pick it up']",4,2
836,6097994550,why did the man lying down roll over on the floor near the end?,"['to move to the camera', 'fall over', 'laughing', 'baby crying', 'let kids walk through']",0,0
837,5256928210,what did the man do after patting the dog s head at the start?,"['continue rubbing dog s head', 'play with toy', 'pet body', 'smile', 'chasing its tail']",0,2
838,6046149003,how many girls are there?,"['five', 'two', 'four', 'one', 'three']",1,1
839,4542882771,why does the baby move his hands?,"['stiring', 'playing piano', 'drawing', 'scoop food', 'caress dog']",4,3
840,8990144134,what does the cat do when it first sat up?,"['pooping', 'eat', 'examine the bag', 'hit the bird', 'cross the ledge']",2,3
841,3526597179,what did the lady in yellow do after talking to the lady in white?,"['hold the girl s hand', 'she drinks it', 'nods her ehad', 'moved', 'turn behind her']",3,4
842,8575881495,what does the girl hold on her hand as she was sitting up in the middle?,"['feed baby', 'shakes the baby', 'stuff toy', 'pin woman s hair', 'play the piano']",2,2
845,3121571439,what does the lady do after finishing dancing at the end?,"['point to someone', 'repeats', 'hugs the man', 'put on man s shoulder', 'jump']",2,4
846,2833209794,what does the man in black do after turning his body to face the wall?,"['waiting', 'catch the ball', 'lean forward', 'walk towards the ladies', 'look at the picture frames']",3,4
847,4658396458,why did the adult stretch out his hands to the baby while the baby is touching the basket?,"['reach the toy', 'holding and supporting the baby', 'reaching for something', 'show affection', 'put the toys back']",3,4
848,5533380417,how is the baby positioned throuh the video?,"['on man s laps', 'sitting on baby seat', 'lie on bed', 'sitting on sofa', 'carried on man s back']",0,0
849,8224504302,why are the two men standing on stage?,"['speeching', 'to receive awards', 'ready to dance', 'playing drums', 'playing guitar']",0,0
850,4488066715,how does the adult react when the baby tries to touch the bowl with his other hand?,"['shouted for help', 'takes a tissue', 'pull hand away', 'give him a ball', 'playing with baby']",2,2
851,7416295940,how does the dog show affection towards the baby?,"['wagging his hands', 'jump at each other', 'kiss his legs', 'bring boy ball', 'lick the baby']",4,4
852,2614918961,why does the baby constantly look down at his hands?,"['babbling', 'reading', 'excited', 'worried', 'playing with a toy']",4,4
853,4260763967,what did the boy in blue do after he turned his head behind at the middle?,"['smiling', 'following him', 'continue playing with toy', 'walk', 'scroll his computer']",3,2
855,6356067859,where could this be happening?,"['hospital', 'barn', 'home corridor', 'roadside', 'zoo']",1,1
857,3626788516,how many people are in the video?,"['four', 'eight', 'two', 'nine', 'ten']",2,2
858,7088595057,why is the black sheep on the hay moving left and right?,"['eating', 'resting', 'eat the grass', 'protect them', 'protecting the black lamb']",5,4
1002,8783897632,why did the man in white get off his bike at the start?,"['ride the bull', 'too muddy to cycle', 'go across the pond', 'setting up', 'to push bike']",1,4
1003,4378803532,why is the lady in beige folding her arms?,"['watching', 'way of standing', 'she scored', 'leaving the place', 'hygiene']",1,0
1004,8531675050,what is the possible relation between lady in black and white and the man in white?,"['baby', 'siblings', 'fatherdaughter', 'husband wife', 'colleagues']",1,4
1005,6772999108,why did the boy bend his arms?,"['stretching', 'hug the girl', 'pick up something on the floor', 'arms were in pain', 'play guitar']",4,4
1006,4798585428,why are the people standing?,"['reading', 'gesturing', 'taking photo', 'light up the room', 'dancing']",2,2
1009,2669452260,how does the guy drink from the can?,"['pinky in the air', 'straw', 'using his hands to unscrew the can', 'pour drink into cup', 'lean the can']",2,1
1010,6516459343,how do the men appear while cutting the shoes?,"['excited about experiment', 'confused', 'playing instrument', 'he watches the model move', 'serious']",4,4
1011,2809330695,how does the baby feel while lying in the crib?,"['restricted', 'confused', 'happy', 'enjoyable', 'restless']",2,4
1013,4123211145,where is this video taken?,"['backyard', 'snow mountain', 'room', 'computer table', 'train']",0,2
1014,4542882771,where is the baby hanging out?,"['along the roadside', 'bathtub', 'house floor', 'dining table', 'kitchen']",3,3
1015,10597533885,where is this happening?,"['playground', 'in the day', 'beach', 'room', 'home']",3,0
1016,5681946487,why does the woman splash water onto the boy?,"['to hurt the boy', 'to wash the boy', 'to play with the boy', 'to make the boy drink water', 'to make the boy cry']",2,1
1018,2705374471,how many people are there in the room?,"['three', 'one', 'four', 'two', 'eight']",2,3
1019,5445581571,where is this video taken?,"['living room', 'dinning table', 'computer table', 'kitchen', 'outside']",0,0
1020,4378803532,why did the lady in beige look at the girl in red as she ran away?,"['watching over kid', 'playing with girl', 'finished performing', 'attempt to fly kite', 'someone took her food away']",0,0
1021,2599937944,why were the ladies watching the guy in black?,"['learning', 'taking picture', 'enjoy the performance', 'like the music', 'watching him bouncing over stream']",4,4
1022,8797589693,why is the lady in white holding a phone at the end?,"['check message', 'speaking on phone', 'anwer a call', 'filming the event', 'playing phone game']",1,3
1023,7330294814,why is the lady in beige holding a soft toy?,"['trying to sell it', 'playing with baby', 'props for photo', 'cleaning the toy', 'tossing to dog']",1,1
1025,7492398760,what does the boy do after the lady starts running at the end?,"['hold someone s legs', 'start running too', 'take off baby clothes', 'shift her feet', 'sit on the tricycle']",2,1
1027,5907839036,where is this happening?,"['bridge', 'trail', 'skate park', 'house', 'bed room']",0,0
1028,4333544549,why is the man in white bent down in the middle?,"['carry the brown dog', 'look at the ants', 'pick up the white item', 'protect against the chemicala', 'caress the dog']",4,4
1029,11566930393,why is the toy not ready to be played with after unwrapping it?,"['got stuck', 'handle not installed', 'hard to balance', 'other hand occupied', 'comfortable at home']",1,1
1030,6272786009,how do the people in the boat move the boat across the water?,"['flexing their body and tail', 'walking', 'press the button', 'paddle', 'kick the water']",3,3
1031,9256409422,how did the lady in black protect herself from the cold?,"['covered with blanket', 'hand gestures', 'crawling', 'woolen cap', 'wear jacket']",1,4
1032,6443512089,what does the child change the pace of his movement into?,"['waddles up and down', 'stop continuously', 'no change', 'slower', 'faster']",2,4
1033,11584566583,how many people can be seen in the video?,"['five', 'two', 'three', 'thirteen', 'eight']",2,1
1034,2442307875,what do the children do after moving their hands next to their ears in the middle of the video?,"['playing with train toy', 'jump up and down', 'playing', 'put down their hands', 'drags the table']",1,3
1035,5064681723,how did the baby keep his head warm?,"['thick clothes', 'mat', 'beanie', 'wear gloves', 'wear warm clothes']",2,2
1036,9217939684,how does the woman in pink react after the baby falls down?,"['goes to help', 'put it down', 'reach out to hold baby', 'happy', 'smiles']",0,2
1037,3581585756,what does the girl do after posing with the woman?,"['hug the woman', 'walk forward', 'continue cycling', 'smile and wave', 'playing with sticks']",0,0
1038,11541421563,how does the woman in brown take a closer look at the book at the start?,"['look at screen', 'move her body forward', 'using a button', 'using the lights from their headband', 'with her right hand']",2,1
1039,3206694342,what does the boy on the right in front do when the others stood up again after the middle?,"['touch the dinosaur', 'bends down', 'bite a slip of paper', 'hold s the rod', 'open the book']",1,1
1040,4671452046,how did the lady in purple prevent the baby from falling when he bend down to stir the cup?,"['grab the collar', 'hold the stomach', 'secure in between her legs', 'in child restraint', 'grab the legs']",2,1
1041,9213637099,where is this?,"['horse enclosure', 'restaurant', 'park', 'childcare center', 'indoors']",2,2
1042,8253302563,where is this happening?,"['bowling alley', 'beach', 'kitchen', 'home', 'hospital']",1,3
1043,6727904179,why did the two man indoor turn their head to the right?,"['look at each other', 'performing on stage', 'looking at painting', 'look at screen', 'posing for camera']",4,3
1044,7728559968,what do the kittens do after sitting up at the end?,"['crawls away', 'rubs against him', 'try to bite', 'look around', 'lady s leg']",3,3
1045,3456030972,what does the child do after making funny face in the middle?,"['fidgeting', 'turn to his back', 'hold toy', 'upset', 'focus on abacus']",1,4
1046,7088595057,where is this video taken?,"['playground', 'stage', 'paddock', 'forest', 'construction site']",2,2
1047,2782307049,why does the woman slide down the rope?,"['doing a flying fox', 'lost balance', 'maintain balance', 'skiing', 'tripped']",0,0
1048,5352022985,why does the dog have to constantly jump up at the beginning?,"['put the dog further', 'show excitement', 'to fight with cat', 'walking in the snow', 'excited']",4,3
1049,8552680285,how does the person standing move her arms?,"['raise it up', 'wave them around', 'move sideways', 'push the stick backwards', 'move in circles']",1,3
